{
  "apiVersion": "nexus.io/v1alpha2",
  "kind": "AssistantHandoff",
  "metadata": {
    "instance_id": "inst_personal8f3a2c",
    "generated_at": "2026-07-20T09:05:00Z",
    "assistant": "claude",
    "role": "setup_executor"
  },
  "spec": {
    "source_of_truth": {
      "kind": "PersonalStack",
      "ref": "personal-stack.personal-local-v1.example.json",
      "stack_id": "personal-local-v1"
    },
    "artifacts": [
      { "kind": "PersonalStack", "ref": "personal-stack.personal-local-v1.example.json" },
      { "kind": "Blueprint", "ref": "blueprint.personal-local.yaml" },
      { "kind": "SetupPlan", "ref": "setup.plan.personal-local.yaml" }
    ],
    "setup_md": {
      "ref": "SETUP.md",
      "is_source_of_truth": false,
      "contains_plaintext_secrets": false
    },
    "secret_handling": {
      "mode": "encrypted_bundle",
      "bundle_ref": {
        "bundle_id": "sb_personal_9d2f7a1c",
        "manifest_ref": "secrets-bundle-manifest.example.json",
        "recipient": {
          "instance_id": "inst_personal8f3a2c",
          "public_key_id": "inst-personal8f3a2c-enc-2026"
        },
        "scheme": "age",
        "refs": [
          { "ref_name": "ANTHROPIC_API_KEY", "service": "anthropic" },
          { "ref_name": "OPENAI_API_KEY", "service": "openai" }
        ]
      },
      "plaintext_in_prompt": false
    },
    "boundaries": {
      "may_choose_architecture": false,
      "may_select_cloud_provider": false,
      "may_enable_multi_user": false,
      "may_add_non_default_provider": false
    }
  }
}
